subtitle_set_id,text,time,duration,location,speaker,is_gameplay
bureau_maze_personnel,"No new pictures, but would you like to see the old ones?",160,,,vbmazepersonnel,
bureau_maze_end1,"Love to help ya hun, but there\ain't nothin more to do here.",0,,,vbmazepreapprovals,
bureau_maze_end1,Now it's all up to Immediate Action.,4.8,,,vbmazepreapprovals,
bureau_maze_end1,"Whatcha doin' here, hun?\Have you got to the bureau chief yet?",9.5,,,vbmazepreapprovals,
bureau_maze_end1,Has he told you all about Max?\Wish I knew the scoop myself.,13,,,vbmazepreapprovals,
bureau_maze_end1,"I'd tell ya straight up,\but news always travels here last.",17.8,,,vbmazepreapprovals,
bureau_maze_end2,"Well, hi there! Y'all found me!\Good for you!",0.5,,,vbmazepreapprovals,
bureau_maze_end2,Can't get approved until you get pre-approved.,5,,,vbmazepreapprovals,
bureau_maze_end2,And listen… Sorry about that easterner in Bridge Repair.,8.5,,,vbmazepreapprovals,
bureau_maze_end2,"Talk about an accent, sheesh!",12.5,,,vbmazepreapprovals,
bureau_maze_end2,"Anyway hun, let me see that document.",16,,,vbmazepreapprovals,
bureau_maze_end2,"Well, looks like everything's in order.\Stand back!",20.5,4,,vbmazepreapprovals,
bureau_maze_end2,That information about your friend Max can't be far off now.\I hope it comes in time!,26,,,vbmazepreapprovals,
bureau_maze_end2,Just take this little old stamped thing across the way to Immediate Action.\They'll get right on it!,32.2,,,vbmazepreapprovals,
bureau_maze_end2,"Well, hi there! Y'all found me!\Good for you!",42,,,vbmazepreapprovals,
bureau_maze_end2,Can't get approved until you get pre-approved.,46,,,vbmazepreapprovals,
bureau_maze_end2,And listen… Sorry about that easterner in Bridge Repair.,49.5,,,vbmazepreapprovals,
bureau_maze_end2,"Talk about an accent, sheesh!",53.5,,,vbmazepreapprovals,
bureau_maze_end2,"Anyway hun, let me see that document.",57.2,,,vbmazepreapprovals,
bureau_maze_end2,"Now hun, you just don't have the document I need.",61,,,vbmazepreapprovals,
bureau_maze_end2,"Tell you what though, head on back to the Atlas face and\go see the fellow with that awful accent in Bridge Repair.",65,,,vbmazepreapprovals,
bureau_maze_end2,"He'll get you on track. And when you're ready,\come on over to my outside door. I'll sneak you right in!",71.5,,,vbmazepreapprovals,
bureau_maze_end2,"Well, hi there! Y'all came back!\Good for you!",81,,,vbmazepreapprovals,
bureau_maze_end2,Can't get approved until you get pre-approved.,85,,,vbmazepreapprovals,
bureau_maze_end2,And listen… Sorry about that easterner in Bridge Repair.,88,,,vbmazepreapprovals,
bureau_maze_end2,"Talk about an accent, sheesh!",92,,,vbmazepreapprovals,
bureau_maze_end2,"Anyway hun, let me see that document.",95.2,,,vbmazepreapprovals,
bureau_maze_end2,"Well, looks like everything's in order!\Stand back!",101,4,,vbmazepreapprovals,
bureau_maze_end2,That information about your friend Max can't be far off now.\I hope it comes in time!,106.5,,,vbmazepreapprovals,
bureau_maze_end2,Just take this little old stamped thing across the way to Immediate Action.\They'll get right on it!,113,,,vbmazepreapprovals,
bureau_maze_end2,"Well, hi there! Y'all came back!\Lemme see your document, hun!",123,,,vbmazepreapprovals,
bureau_maze_end2,"Now, hun, you just don't have the document I need.",129.5,,,vbmazepreapprovals,
bureau_maze_end2,"Tell you what though, head on back to the Atlas face and\go see the fellow with that awful accent in Bridge Repair.",133.8,,,vbmazepreapprovals,
bureau_maze_end2,"He'll get you on track. And when you're ready,\come on over to my outside door. I'll sneak you right in!",140.5,,,vbmazepreapprovals,
bureau_maze_greet_nocards,Look who's back. The big shot.,0,,,vbmazegreet,
bureau_maze_greet_nocards,"No raise, I take it?\Well then you can just forget about these cards.",3.7,,,vbmazegreet,
bureau_maze_greet_nocards,Why don't you sneak around the side to Pre-Approvals?,8,,,vbmazegreet,
bureau_maze_greet_nocards,Maybe you can get her a raise.,11.8,,,vbmazegreet,
bureau_maze_greet_nocards,But she won't stamp your document. You know why?\'Cause you don't have a document!,14.2,,,vbmazegreet,
bureau_maze_greet_nocards,"Look who's back, with a fabulous new document.\Why, it's the chief's best friend.",22.5,,,vbmazegreet,
bureau_maze_greet_nocards,"Well. No raise, no cards!",31,,,vbmazegreet,
bureau_maze_greet_nocards,But why don't you sneak around the side to Pre-Approvals?\Maybe she'll fall for your empty promises!,34.3,,,vbmazegreet,
bureau_maze_greet_nocards,"Oh, it's you again.",43.1,,,vbmazegreet,
bureau_maze_greet_nocards,No raise?\Well then kiss these cards goodbye!,45,,,vbmazegreet,
bureau_maze_greet_nocards,And don't even ask what people are saying about Max.,49,,,vbmazegreet,
bureau_maze_greet_nocards,Just run along to your little bridge and your bureau chief.,53,,,vbmazegreet,
bureau_maze_greet_nocards,I'll just sit here and starve!,57.5,,,vbmazegreet,
bureau_maze_security,"So, you wanna march with the big boys,\do ya soldier?",0,,,vbmazesecurity,
bureau_maze_security,We'll see about that.\Security is our A-1 priority!,5,,,vbmazesecurity,
bureau_maze_security,Fill out this form and we'll take it from there.,9.9,,,vbmazesecurity,
bureau_maze_security,"You haven't completed the form, soldier.",17.7,,,vbmazesecurity,
bureau_maze_security,Come back when you can follow orders!,19.9,,,vbmazesecurity,
bureau_maze_security,You eat your ice cream from a cone?,27,,,vbmazesecurity,
bureau_maze_security,Doesn't bode well.\I'm keeping you under constant surveillance.,29.7,,,vbmazesecurity,
bureau_maze_security,You eat your ice cream from a bowl?\And expect our trust?,39,,,vbmazesecurity,
bureau_maze_security,"From now on, you'll be watched like a hawk!",44.4,,,vbmazesecurity,
bureau_maze_security,You eat your ice cream from the carton?\No restraint!,52,,,vbmazesecurity,
bureau_maze_security,We'll be monitoring every step of your progress!,56,,,vbmazesecurity,
bureau_maze_security,"I have your form on file, soldier,\but I guess there's no harm in updating it.",61.7,,,vbmazesecurity,
